Gujrati,marathi
"જમીન, જળ કેન્દ્ર નવી ગૅલરીના પ્રદર્શનનું સિસોનું નિરુપણ","नवीन दालनातील सिसोच्या प्रदर्शनात जमीन, पाण्याचे चित्रण केंद्रभागी आहे"
"2022માં સ્વિમિંગ પૂલમાં તરતા લોકો વાઇસેન્ટ સિસોના આર્ટવર્ક પૈકીના જ છે જે 13 જાન્યુઆરીથી શરૂ થનારી ટિએરા ડેલ સોલ ગૅલરીમાં પ્રદર્શિત થશે. (ફોટો સૌજન્ય, વાઇસેન્ટ સિસો)","तिएरा डेल सोल गॅलरीमध्ये 13 जानेवारीपासून सुरू होणाऱ्या प्रदर्शनात ""जलतरण तलावात पोहोत असलेले लोक"" ही व्हिन्सेंट सिसोची 2022 मधील कलाकृती दाखवली जाईल. (छायाचित्र सौजन्य व्हिन्सेंट सिसो)"
"ટિએરા ડેલ સોલ પશ્ચિમ હોલીવૂડમાં એક નવા ગૅલરી સ્થાન ખાતે ""વાઇસેન્ટ સિસો: મેમરીઝ ઑફ ધ લૅન્ડ એન્ડ વૉટર""ને પ્રસ્તુત કરવામાં ખુશી અનુભવે છે. સિસો 2012થી સ્ટુડિયો આર્ટ પ્રોગ્રામમાં એક કલાકાર રહ્યાં છે. સિસોનો જન્મ મેડ્રિડમાં 1962માં થયો હતો અને તેમનો ઉછેર વેનેઝુએલા, ત્રિનિદાદ અને માયામી વચ્ચે થયો હતો; તે પોતાની 20 વર્ષની ઉંમરની શરૂઆતમાં જ પોતાના કુટુંબ સાથે દક્ષિણ કૅલિફોર્નિયામાં જતા રહ્યાં હતા.","तिएरा डेल सोल त्यांच्या पश्चिम हॉलिवुडमधील नवीन दालनामध्ये ""व्हिन्सेंट सिसो: मेमरीज ऑफ द लँड अँड वॉटर"" सहर्ष सादर करत आहे. 2012 पासून स्टुडिओ आर्ट प्रोग्राममध्ये एक कलाकार म्हणून सिसो सहभागी आहे, हे त्याचे पहिलेच स्वतंत्र प्रदर्शन आहे. सिसोचा जन्म 1962 मध्ये माद्रिदमध्ये झाला आणि व्हेनेझुएला, त्रिनिदाद आणि मियामी येथे त्याचे संगोपन झाले; 20 व्या दशकाच्या पूर्वार्धात तो त्याच्या कुटुंबासह दक्षिण कॅलिफोर्निया येथे स्थलांतरित झाला."
"વિષય વસ્તુ પર નિષ્ણાતીપૂર્ણ કામ કરીને, સિસોએ લેન્ડસ્કેપ, પોર્ટ્રેટ અને સ્થિર-જીવન કાર્યોની એક પ્રોલિફિક સીરિઝ જનરેટ કરી છે જેમાં એક્રિલિક, પેસ્ટલ, પેન્સિલ અથવા વૉટરકલરનો ઉપયોગ કર્યો છે. કૌટુંબિક પોર્ટ્રેટથી લઈને તેના પોતાના સંદર્ભ ફોટોગ્રાફ અને પુનઃસંગ્રહ સુધી, તેની રંગીન રચનાઓમાં સમગ્ર મીડિયામાં તેની રુચિઓ તથા કુશળતાની તેની શ્રેણીનું પ્રદર્શન થાય છે. સિસોના ઉષ્ણકટિબંધીય પરિદૃશ્ય અને સમુદ્રી દૃશ્ય તેમના ભૂતકાળના ભૂગોળને દર્શાવે છે, જેમાં સમૃદ્ધ પૅટર્નનો ઉપયોગ કરવામાં આવ્યો છે અને સંસ્કૃતિ, સ્મૃતિ અને પર્યાવરણની વચ્ચે સાર્થક સંબંધ બનાવવા માટે લોકોને શામેલ કરવામાં આવે છે. સિસોએ પોતાની કલાકૃતિઓને સ્પેનિશ અને અંગ્રેજીના મિશ્રણમાં શીર્ષક પ્રદાન કર્યું છે જે લૉસ એંજેલસ કાઉન્ટીમાં તેમના જીવનની પ્રસિદ્ધ અને અભિન્ન જટિલતાઓને દર્શાવે છે. ""વાઇસેન્ટ સિસો: મેમરીઝ ઑફ ધ લૅન્ડ એન્ડ વૉટર"" શનિવાર, 13મી જાન્યુ એ સાંજે 6-8 વાગ્યે રિસેપ્શનની સાથે ખુલશે. આ પ્રદર્શન રવિવાર, 3 માર્ચ સુધી જોઈ શકાય છે.","विविध विषय वस्तूंवर अतिशय कौशल्यपूर्वक काम करून, सिसोने अ‍ॅक्रिलिक, पेस्टल, पेन्सिल किंवा जलरंगाच्या माध्यमातून देखावे, व्यक्तिचित्रे आणि स्थिर चित्रण यांच्या विपुल मालिकांची निर्मिती केली आहे. कौटुंबिक व्यक्तिचित्रे, संदर्भासाठी घेतलेली छायाचित्रे आणि पुनर्संकलन यांतून काढलेली रेखाटने, बहुरंगी रचना विविध माध्यमांबाबत त्याची आवड व कौशल्य दर्शवतात. सिसोने रंगवलेल्या उष्णकटिबंधीय आणि समुद्राच्या देखाव्यांमध्ये त्याच्या भूतकाळातील भूभागांचे प्रतिबिंब दिसते, संस्कृती, स्मृती आणि पर्यावरण यांचा अर्थपूर्ण मेळ साधण्यासाठी त्यामध्ये समृद्ध रचना आणि लोकांचा समावेश आहे. लॉस एंजेल्समधील उत्सवी आणि आयुष्याच्या अंतर्गत गुंतागुंती ठळक करणाऱ्या त्याच्या आयुष्याची आठवण जपण्यासाठी, सिसो त्याच्या कलाकृतींना स्पॅनिश आणि इंग्रजीचे मिश्रण असलेली शीर्षक देतो. ""व्हिन्सेंट सिसो: मेमरीज ऑफ द लँड अँड वॉटर"" शनिवार, 13 जानेवारी रोजी संध्याकाळी 6-8 या वेळात स्वागत समारंभासह सुरू होत आहे. रविवार, 3 मार्चपर्यंत प्रदर्शन पाहता येईल."
"ટિએરા ડેલ સોલ ગૅલરી 7414 સાંતા મોનિકા બુલિવર્ડમાં આવેલી છે. માહિતી માટે, tierradelsolgallery.orgની મુલાકાત લો.","तिएरा डेल सोल कलादालन, 7414 सांता मोनिका बुलेवर्ड येथे आहे. अधिक माहितीसाठी, भेट द्या tierradelsolgallery.org."
"સમસ્યાને ઉકેલવા માટે જૂનાને અપનાવો, નવાને સ્થાન આપો","समस्या सोडविण्यासाठी जुन्याचा अंगीकार करा, नवीनसाठी जागा ठेवा"
"સરહદના લેવલે, અમને સિડની CBDને એક એવા ઉદાહરણના ક્ષેત્ર તરીકે જોવાની જરૂર છે જે પોતાના પૂર્વ-સમાધાન પરિદૃશ્યથી આગળ વધીને બે-માળનું શહેર બની ગયું છે, જેની મહત્તમ ઊંચાઈ 150 ફૂટથી લઈને આજના સૌથી ઊંચા ટાવર છે. ખૂબ ઓછા લેવલે, પરિવહન નોડની ફરતે આવેલા સિડનીના શહેરના કેન્દ્રમાં પણ આવું થઈ શકે છે. આંતરિક ઉપનગરોનો પણ વિકાસ થવો જોઈએ, જેમાં મુખ્ય સ્થળોએ વૃક્ષોની ટોચથી ઓછી ઊંચાઈ પર વધુ વાજબી અપાર્ટમેન્ટમાં રહેવું શામેલ છે. અલબત્ત, આવાસમાં નવા વિકાસને સારી રીતે ડિઝાઇન કરવું જોઈએ અને વૃક્ષો, ભૂનિર્માણ અને બગીચાઓને અન્ય આવશ્યક મૂળભૂત સંરચનામાં શામેલ કરવામાં આવવા જોઈએ.","पंचक्रोशीमध्ये, आपण सिडनी CBD कडे अशा एका भागाचे उदाहरण म्हणून पाहिले पाहिजे, जो वसाहतपूर्वीच्या आपल्या स्थितीमधून दुमजली शहरात विकसित झाला आहे, जिथे पूर्वी कमाल 150 फूट उंचीची घरे होती, तिथे आज उंचच्या उंच मनोरे उभे राहिले आहेत. परिवहन सुविधांच्या सभोवती असलेल्या सिडनीच्या टाऊन सेंटर्सबाबतही थोड्या फार फरकाने हेच घडू शकते. नवीन उपनगरात उंच वृक्षांच्या सावलीखाली उभ्या राहू शकतील अशा उंचीच्या आणि किफायतशीर इमारती असल्या पाहिजेत. अर्थात वाढत्या गृहनिर्मितीचे सुनियोजन करताना त्यात इतर आवश्यक पायाभूत सुविधांसह झाडे, मोकळ्या जागा तसेच बागांचा समावेश केला पाहिजे."
"અમારી પ્લાનિંગ સિસ્ટમને પણ એ રીતે અપનાવવાની જરૂર છે કે જેથી કરીને પેટાનગરોની સમિતિઓમાંના પ્લાનર, કે જે ફેરફાર માટે ઓછા સપોર્ટિવ દેખાય છે, તેઓ જ ફક્ત એકલા આપણાં પેટાનગરોના ભાવિ આકારના નિર્ણાયકો ન રહે. આગળ વધવાનો એક માર્ગ એ પણ હોઈ શકે કે એક સ્વતંત્ર નિર્ણય લેનારું એકમ હોય જે સારી ક્વૉલિટીવાળી ડિઝાઇનનું સમર્થન કરે, સિવાય કે તે વૃક્ષોની ટોચથી નીચે ફિટ થતું હોય અને તેમાં કૌટુંબિક રીતે રહેવાની જગ્યા, મોટી બાલકનીઓ, સામાન્ય બગીચા શામેલ હોય અને એક મૈત્રીપૂર્ણ દેખાવ પ્રસ્તુત થાય. આ વર્તમાન NSW સરકારના આર્કિટેક્ટ માટે એક ભૂમિકા હોઈ શકે છે જે સાવચેતીપૂર્વક તૈયાર કરવામાં આવેલા અનુપાલન કોડ હેઠળ કામ કરી રહ્યાં હોય.","आमच्या नियोजन प्रणालीचा सुद्धा अंगीकार केला गेला पाहिजे, ज्यायोगे बदलाला फारसे अनुकूल नसलेले उपनगरीय परिषदेतील नियोजनकर्तेच फक्त त्यांच्या उपनगराला भविष्यात कसा आकार दिला जाईल हे ठरवू शकणार नाहीत. उंच वृक्षांच्या खाली आणि तरीही कुटुंबाला राहण्यासाठी योग्य जागा, मोठ्या बाल्कनी, सामाईक बगीचे असतील तसेच ज्याचे स्वरूप मैत्रीपूर्ण असेल, अशा दर्जेदार रचनांमध्ये तज्ज्ञ असलेले स्वतंत्र निर्णय घेणारे मंडळ हा एक दूरगामी मार्ग असू शकतो. काळजीपूर्वक रचना केलेल्या अनुपालन संहितेनुसार काम करणाऱ्या वर्तमान NSW सरकारी वास्तुविशारदाकडे हे पद दिले जाऊ शकते."
"પાછલા દાયકાથી વધુ સમયથી, આપણું જીવન ટેકનોલોજીના માધ્યમથી બદલાઈ ગયું છે, જેમાં ઘણા હવે ઘરેથી કામ કરી રહ્યાં છે અને સિડનીએ મેટ્રો અને લાઇટ રેલ સિસ્ટમનું એક પ્રભાવશાળી નેટવર્ક ઊભું કર્યું છે. ઑનલાઇન ખરીદી કરવાની આપણી ક્ષમતાએ આપણી ખરીદીની રીત બદલી છે અને સ્માર્ટફોનના સંચારને કારણે મિત્રો અને પરિવારો હવે નજીક લાગે છે. એક સિસ્ટમથી બીજામાં આ બધા અનુપાલનો વારસાગત સંરક્ષણને પસંદ કરવાને બદલે અનુકૂળતા પ્રમાણે  ફરીવાર ઉપયોગ પર ફોકસ કરવાના પ્લાનિંગ મારફતે આપણા બંધાયેલા વાતાવરણમાં પણ થઈ શકે છે.","मागील दशकापासून, तंत्रज्ञानाद्वारे आपल्या जीवनात बदल घडले आहेत, अनेकजण घरून काम करतात आणि सिडनीमध्ये मेट्रो व वेगवान रेल्वेचे प्रभावित करणारे जाळे तयार झाले आहे. ऑनलाईन खरेदी करण्याच्या आपल्या क्षमतेमुळे खरेदीची पद्धत बदलली आहे आणि स्मार्टफोनवरील संवादामुळे मित्र परिवार जवळ आल्यासारखा वाटतात. वारशाचे जतन करण्यास प्राधान्य देण्याऐवजी अनुकूल पुनर्वापरावर लक्ष केंद्रित करून केलेल्या नियोजनामुळे एका प्रणालीतून दुसरीमध्ये होत असलेली रुपांतरणे आपल्या आसपासच्या पर्यावरणात सुद्धा घडू शकतात."
ક્રિસ જોહ્ન્સન પૂર્વ NSW સરકારી આર્કિટેક્ટ(1995-2005) અને NSW ડિપાર્ટમેન્ટ ઑફ પ્લાનિંગના ઍક્ઝિક્યુટિવ ડાયરેક્ટર(2005-2009) છે. તે 2011 અને 2019ની વચ્ચે અર્બન ટાસ્કફોર્સ ઑસ્ટ્રેલિયાના CEO હતા.,ख्रिस जॉन्सन हा एक माजी NSW सरकारी वास्तुविशारद (1995-2005) आणि NSW नियोजन विभागाचा कार्यकारी संचालक आहे (2005-2009). 2011 ते 2019 दरम्यान तो अर्बन टास्कफोर्स ऑस्ट्रेलियाचा CEO होता.
નારી સમાનતા માટે એક અંતિમ પ્રયત્ન,महिला समानतेसाठी शेवटचा प्रयत्न
"ગયા વર્ષે, વર્લ્ડ ઇકોનોમિક ફોરમે આગાહી કરી હતી કે દરેક રાષ્ટ્રમાં લિંગ સમાનતાને હાંસલ કરવા માટે પાંચ પેઢીઓનો સમય લાગશે. હવે વર્લ્ડ બેંક આ ટાઇમ ફ્રેમને ઝડપથી વેગવાન બનાવવા માગે છે.","मागील वर्षी, जागतिक आर्थिक मंचाने असे भाकीत केले होते की प्रत्येक देशामध्ये लिंगभाव समानता यायला पाच पिढ्या जाव्या लागतील. आता जागतिक बँकेला या प्रक्रियेला वेग द्यायचा आहे."
"આંતરરાષ્ટ્રીય નાણાકીય સંસ્થા 2030 સુધી છોકરીઓ અને મહિલાઓના અધિકારો અને આર્થિક તકોને મહત્વપૂર્ણ રીતે આગળ વધારવાના હેતુથી એક વ્યૂહરચના શરૂ કરવા માટે તૈયાર છે. આ યોજના નાણાકીય, ટેક્નોલોજીકલ નવીનતા અને સાર્વજનિક પૉલિસી અને કાયદામાં ફેરફારોના ઍક્સેસ દ્વારા સમાવેશિતા અને લવચીકતામાં સુધારણા કરવા પર ફોકસ કરે છે.","2030 पर्यंत मुली आणि स्त्रियांसाठी अधिकार आणि आर्थिक संधींमध्ये ठळक प्रगती घडवून आणण्याच्या ध्येयाने धोरणास प्रारंभ करण्यास आंतरराष्ट्रीय वित्त संस्था सज्ज झाली आहे. वित्त पुरवठा, तांत्रिक कल्पकता आणि सार्वजनिक धोरण व कायद्यांच्या उपलब्धतेद्वारे समावेश आणि लवचिकतेत सुधार यावर ही योजना केंद्रित आहे."
"તાજેતરની શોધ દર્શાવે છે કે સોશિયલ કાયદા અને માનસિકતા બન્ને બદલાઈ શકે છે, ઉદાહરણ તરીકે, પુરુષો અને છોકરાઓને શામેલ કરવાથી લૈંગિક સમાનતા માટે તેમનો સપોર્ટ અને સમર્થન વધી શકે છે, યોજનાની સલાહકારી રૂપરેખામાં કહેવામાં આવ્યું છે. ""સોશિયલ કાયદા અને માનસિકતા કેવી રીતે દૈનિક અપેક્ષાઓ, પ્રાથમિકતાઓ અને પ્રથાઓને આકાર આપે છે ... તેની વધુ સારી સમજની સાથે સકારાત્મક લૈંગિક પરીણામોને વેગ આપી શકાય છે અને વધારી શકાય છે.""","ताज्या संशोधनातून असे दिसून आले आहे की सामाजिक रुढी आणि दृष्टिकोन बदलू शकतात, उदाहरणार्थ, लिंगभाव समानतेबाबत योजना राज्यांचा सल्ला देणारा मसूदा तयार करण्यामध्ये पुरुष आणि मुलांना सहभागी करून घेतल्यास त्यांची मदत वाढेल आणि हे त्यांच्याही गळी उतरेल. सकारात्मक लिंगभाव निष्पत्तीला वेग देता येईल आणि ... दैनंदिन अपेक्षा, प्राधान्ये आणि पद्धतींना सामाजिक रुढी आणि दृष्टिकोन कसा आकार देतात याबाबत जास्त चांगली समज निर्माण होईल.'"
