Gujrati,marathi
"સાંજના સમયે DIYનું એક નાનું કામ, દરવાજાની ચોખટના નીચલા ભાગને સૉ/ચિઝેલથી કાપવું, જ્યાં અમે ઇચ્છીએ છીએ કે લાદી નીચે સારી રીતે ફિટ થઈ જાય.",संध्याकाळी पटकन करायचे काम म्हणजे आम्हाला जिथे खाली नीट फरशी बसवायचे आहे तिथे डोअर जँब्सच्या तळाचे भात टेनॉन सॉने किंवा छिन्नीने तासून काढायचे आहेत.
હૉલવે કોર્ક અંડરલે પણ નીચે છે,हॉलवेमधील कॉर्क अंडरलेदेखील बसवून झाला आहे
"અમે હૉલવેની લાદીનું કામ ગઈકાલે જ સમાપ્ત કર્યું! પછી સવારે 5 વાગ્યાથી હીથ્રોથી વસ્તુ 1 એકત્રિત કરવાનું શરૂ કર્યું, પછી એક ઝપકી અને છેવટે સીધા હૉલવેની તરફ; ઝાલરો લગાડી. ગુંદર સુકાઈ જાય તે પછી સીલ લગાડશું","काल आम्ही हॉलवेमधली फरशी बसवण्याचे काम पूर्ण केले! नंतर आज पहाटे 5 वाजता हीथ्रोवरून थिंग 1 ताब्यात घेण्यासाठी निघालो, नंतर एक डुलकी काढली, आणि थेट हॉलवेच्या कामासाठी आलो, स्कर्टिंग बसवले. गोंद नीट वाळला की पट्टी लावू"
"ચાલો કલ્પના કરીએ કે એક ખૂબ જ લાંબુ વેબ પેજ છે જેમાં ઘણા વિભાગો છે (જેમ કે સિંગલ-પેજ HTML સ્પેસિફિકેશન). જો વપરાશકર્તા કોઈ ચોક્કસ વિભાગની વિનંતી કરે (જેમ કે page.html#section7), તો શું થાય જો વેબ સર્વર તે વિભાગને પહેલા સ્ટ્રીમ કરે અને તે પછી બાકીના વિભાગોને સ્ટ્રીમ કરે?","भरपूर विभाग असलेल्या एका लांबलचक वेब पेजची कल्पना करा (उदा., सिंगल पेज HTML स्पेसि.). एखाद्या वापरकर्त्याने एखाद्या विशिष्ट विभागाची विनंती केली, (उदा. page.html#section7), तर सर्व्हरने हा विभाग सर्वप्रथम स्ट्रीम केला आणि बाकीचे विभाग त्यानंतर स्ट्रीम केले तर?"
સ્ટ્રીમનો ક્રમ નક્કી કરો:,स्ट्रीमचा क्रम:
1. HTML દસ્તાવેજની શરૂઆત <body> સુધી,1. HTML दस्तऐवजाची सुरुवात <body> पर्यंत
2. વિભાગ 7 માટે HTML,2. विभाग 7 साठी HTML
"3. વિભાગ 1, 2, 3 વગેરે માટે HTML.","3. विभाग 1, 2, 3 इ. साठी HTML"
તો પછી બ્રાઉઝર વેબ પેજ પર વિભાગ 1 થી 6 ને વિભાગ 7 થી *ઉપર* શામેલ કરવાની ખાતરી કરશે.,"त्यानंतर ब्राउझर त्या वेब पेजवर विभाग 1 ते 6 हे विभाग 7 च्या ""वर"" समाविष्ट केल्याची खात्री करेल."
શું આનો કંઈ અર્થ થાય છે? શું આ ઉપયોગી થશે?,हे बरोबर वाटते का? याचा उपयोग होईल का?
હું જે હાંસલ કરવા માગુ છું તે એ છે કે લિંક કરવામાં આવેલા વિભાગ (#section7)ને JavaScriptની સાથે ફરીથી લાગુ કર્યા વિના શક્ય તેટલી ઝડપથી  રેન્ડર કરવામાં આવે. હું બસ એક ખૂબ લાંબો HTML દસ્તાવેજ બનાવવા માગુ છું પણ હજી પણ લિંક કરવામાં આવેલા વિભાગોને શક્ય તેટલી ઝડપથી રેન્ડર કરવા માગુ છું. તે ફક્ત HTML સાથે કામ કરવા જોઈએ.,"मला काय साध्य करायचे आहे, तर JavaScript सह पुन्हा अंमलबजावणी न करता लिंक केलेला विभाग  (#section7) शक्य होईल तितक्या लवकर रेंडर झाला पाहिजे. मला भलेमोठे HTML दस्तऐवज तर हवेच आहे पण तरीही मला लिंक केलेले विभाग शक्य तितक्या लवकर रेंडर करायचे आहेत. हे फक्त HTML वापरून झाले पाहिजे."
કન્ટેન્ટને આ રીતે સ્ટ્રીમ કરી શકાય છે અને પછી બ્રાઉઝર દરેક <contents>ને તેના <div>માં દાખલ કરશે.,"आशय याप्रकारे स्ट्रीम झाला पाहिजे, आणि मग ब्राउझर प्रत्येक <contents> त्याच्या <div> मध्ये इंजेक्ट करेल."
<div id=sec1></div>,<div id=sec1></div>
<div id=sec2></div>,<div id=sec2></div>
વગેરે.,इत्यादि.
<div id=sec7>વિભાગ 7…</div>,<div id=sec7>section 7…</div>
<contents for=sec1>વિભાગ 1…</contents>,<contents for=sec1>section 1…</contents>
<contents for=sec2>વિભાગ 2…</contents>,<contents for=sec2>section 2…</contents>
વગેરે.,इत्यादि.
"આને ક્રમ વિના સ્ટ્રીમ કરવામાં આવશે, પરંતુ બ્રાઉઝર HTML દસ્તાવેજને એ રીતે અસેમ્બલ કરશે જાણે કે તેને ક્રમમાં સ્ટ્રીમ કરવામાં આવ્યા હોય.","हे क्रमानुसार स्ट्रीम होणार नाही, पण ब्राउझर तो HTML दस्तऐवज अशा रीतीने असेंबल करेल, की जणू तो क्रमानुसारच स्ट्रीम झाला होता."
"@user22 તમે દસ્તાવેજને JS વિના પણ આ રીતે ફરી ક્રમબદ્ધ કરી શકો છો. જો તમે ઇચ્છતા હોવ કે સર્વર કંઈક કરે, તો તમે URL ના હૅશ ભાગનો ઉપયોગ કરી શકતા નથી, પરંતુ તમે ક્વેરી સ્ટ્રિંગ શોધ પેરામીટરનો ઉપયોગ કરીને સર્વરને જણાવી શકો છો કે તમારે કયો વિભાગ પહેલા જોઈએ છે. ભાગોને ફરીથી ક્રમબદ્ધ કરવા માટે તમારી પાસે વિકલ્પ છે:","@user22 तुम्ही JS न वापरताही अशाप्रकारे दस्तऐवजांचा क्रम लावू शकता. सर्व्हरकडून जर तुम्हाला काही व्यवस्थित काम करून हवे असेल, तर तुम्ही URL चा हॅश पार्ट वापरू शकणार नाही. पण तुम्हाला कोणते विभाग आधी हवे हे सर्व्हरला सांगण्यासाठी तुम्ही क्वेरी स्ट्रिंग सर्च पॅरामीटर वापरू शकता. या भागांचा क्रम लावण्यासाठी तुम्हाला पर्याय उपलब्ध आहे:"
1. CSSનો ઉપયોગ કરો,1. CSS वापरा
2.સ્લૉટ સાથે નમૂનોનો ઉપયોગ કરો,2. स्लॉट्स असलेली टेम्प्लेट वापरा
"@user23 હા. સમસ્યા એ છે કે વિઝ્યુઅલ ઓર્ડર (જે વપરાશકર્તા જુએ છે) DOM ઓર્ડર સાથે મેળ ખાતો નથી. જો ત્યાં કોઈ એવી HTML સુવિધા હાજર હોય કે જે ક્રમ વિના સ્ટ્રીમ કરવાની પરવાનગી આપી શકે તો તે ઉપયોગી હોઈ શકે છે, પરંતુ બ્રાઉઝર તે પછી DOMના કન્ટેન્ટને ક્રમમાં ગોઠવશે.","@user23 होय. प्रश्न असा आहे की दृष्य क्रम (वापरकर्त्याच्या डोळ्यांना दिसणारा क्रम) DOM च्या क्रमाशी जुळत नाही. क्रमानुसार स्ट्रीम न करू देणारे एखादे HTML वैशिष्ट्य असते तर ते उपयोगी पडले असते, पण मग ब्राउझरने DOM मधील सर्व आशय क्रमानुसार लावला असता."
પરંતુ સ્લૉટ અભિગમ આશાસ્પદ દેખાય છે. હું એકવાર અજમાવી જોઈશ.,पण स्लॉट्सची पद्धत जास्त विश्वासार्ह वाटते. मी ती वापरून बघेन.
"@user22 ઓહ, શું તમે ઇચ્છો છો કે બ્રાઉઝર DOM ઓર્ડરને ઠીક કરે?","@user22 ओहो, म्हणजे तुला ब्राउझरने DOM क्रम ठरवणे अपेक्षित आहे का?"
"@user23 હા, એ જ વિચાર છે. વિભાગ 7ને પહેલાં માત્ર એ કારણસર સ્ટ્રીમ કરવામાં આવશે કે વપરાશકર્તા તેને શક્ય તેટલા જલ્દી જોઈ શકે. જો તે DOM ઓર્ડરને પ્રભાવિત કર્યા વિના સંભવ થઈ શકે, તો એ સારું રહેશે, તેથી બ્રાઉઝર એ ખાતરી કરશે કે પરિણામી DOM ઓર્ડર વિઝ્યુઅલ ઓર્ડર સાથે મેળ ખાય.","@user23 होय, तेच अपेक्षित आहे. वापरकर्त्याला ताबडतोब पाहता यावे या एकाच कारणासाठी विभाग 7 चे स्ट्रीमिंग आधी होईल. DOM क्रमावर परिणाम न होऊ देता हे शक्य करता आले, तर चांगले होईल, म्हणजे ब्राउझर खात्री करू शकेल की निष्पन्न होणारा DOM क्रम प्रत्यक्ष दिसणार्‍या क्रमाशी जुळेल."
"બીજી રીતે કહીએ તો, સૌથી પહેલા વિભાગ 7ને સ્ટ્રીમ કરો પણ અંત પરિણામ એવું બનાવો (DOM અને વિઝ્યુઅલ) કે જાણે બધા વિભાગો ક્રમમાં સ્ટ્રીમ થયા હોય.","याचाच अर्थ असा, की विभाग 7 आधी स्ट्रीम करायचा पण अंतिम निकाल (DOM आणि दृष्य) असा असेल, की सर्व विभाग क्रमानुसारच स्ट्रीम झाले आहेत."
@user22 @user23 JS વિના PHOOOS પર એક નજર નાખો: https://github.com/niutech/phooos,@user22 @user23 JS वगळून PHOOOS पहा. https://github.com/niutech/phooos
લઘુચિત્રો પર મારો હાથ અજમાવી જોઉં છું,मिनिएचर्स करण्याचा प्रयत्न करत आहे
ફરીથી સરખું કર્યું!,याचे डोके पुन्हा बनवले!
"વાસ્તવમાં નીડેટાઇટ (લીલી સામગ્રી)નો આનંદ લઈ રહ્યાં છે, આ બબલ ગમ વડે મૂર્તિકલા કરવા જેવું છે પણ તમને તેની ટેવ પડી જાય છે અને જ્યારે તે ઠીક થઈ જાય તે કઠણ અને ફ્લેક્સિબલ બની જાય છે",नीडटाईट (हिरवा पदार्थ) हाताळायला खरेच मजा येत आहे. हे खरंतर बबल गममध्ये शिल्पकृती केल्यासारखे वाटते. पण तुम्हाला त्याची सवय होते आणि हे वाळल्यानंतर चांगले टिकाऊ आणि लवचिक बनते.
વધુ લઘુ સામગ્રી,आणखी मिनिएचर्स
શારીરિક રૂપથી સચોટ લીલું M&M,शरीररचनाशास्त्राच्या दृष्टीने बिनचूक हिरवे M&M
"@user26 એ ચીડાઇને જવાબ આપ્યો, હું તેને પ્રેમ કરું છું*",@user26 म्हणाला. आय लव्ह हर*
@user27 હીહી તમારો આભાર user26,@user27 हेहे धन्यवाद user26
"ઓકે, હું જાણું છું કે આગલો વીડિયો રૂફિંગ કરનારા કોન્ટ્રાક્ટરોને મારાથી નારાજ કરશે, પણ એ તેમના માટે નથી. એ તમારા માટે છે. જો તમે એ વ્યક્તિ છો જેમને રૂફિંગ કોન્ટ્રાક્ટર પરવડી શકે એમ નથી, તો પછી તમારે આ વીડિયો જોવો જ રહ્યો. આ તમને બતાવશે કે તમે તમારા જૂના ધાબાને જાતે જ  કેવી રીતે કવર કરી શકો છો. અને તે ખૂબ જ સરળ છે, જાણે કે ફક્ત છોલવા અને ચોંટાડવા જેવી સરળ સિસ્ટમ.","ओके, पुढच्या व्हिडिओमुळे रूफिंग काँट्रॅक्टर माझ्यावर भडकतील, पण हा व्हिडिओ त्यांच्यासाठी नाही. हा तुमच्यासाठी आहे. 
रूफिंग काँट्रॅक्टर तुम्हाला परवडत नसतील, तर तुम्ही हा व्हिडिओ पहायलाच हवा. या व्हिडिओमध्ये सध्या असलेल्या जुन्या छतावर तुम्ही कसे कव्हर करू शकाल हे दाखवले आहे. एकदम सोपे आहे. पील अँड स्टिक पद्धत वापरायची आहे."
"ચીયર્સ, તમને બધાને. હવે આ જુઓ. મેં ખરેખર એટલું પણ નથી ખાધું કે હું મોંઢું લુછી શકું, પરંતુ હું તમને એ બતાવી શકું છું કે મારા મોંઢામાંથી લાળ ટપકી રહી છે. તમે સમજી રહ્યાં હશો કે મારો કહેવાનો અર્થ શું છે? તો જુઓ, હું એ જ કરવા જાઉં છું. તમે લોકો મને નીચે કૉમેન્ટ વિભાગમાં બતાવો કે તમે શું કરશો? તમે આને કેવા પ્રકારના શાક સાથે પીરસશો? અને એ ભૂલશો નહીં કે આ એક બજેટ-ફ્રેન્ડલી ભોજન છે, બરાબર? તો ચાલો હું આગળ વધું છું અને પોતાના માટે આ દ્રાક્ષના કૂલ-એડનો ગ્લાસ પીઉં છું. હા, સર.","सर्वांना चीअर्स! आता हे पहा. तोंड पुसण्याइतके मी खाल्लं नाहीये तरीही, माझ्या तोंडाला पाणी सुटले आहे. कळलं का? आता पहा. मी यामध्ये काय करत आहे. खाली कमेंट विभागामध्ये तुम्ही सर्वांनी मला सांगा की तुम्ही काय केले असते? याच्यासोबत कोणत्या भाज्या वाढल्या असत्या. आणि हे विसरू नका, की हे बजेट फ्रेंडली जेवण आहे. ठीक? तर चला, आता याच्यासोबत हे ग्रेप कूल एडचा ग्लास भरून घेत आहे, आणि हे संपवत आहे. होय, सर."
"ઇટલીના કોસામાં તમારું સ્વાગત છે. કોસાને એક પ્રાચીન રોમન વસાહત માનવામાં આવે છે. પાછલી સદીમાં આ સ્થાનનું ઓછામાં ઓછું ચાર વાર ખોદકામ કરવામાં આવ્યું હતું. જો કોસા મૂળ રીતે રોમન સાઇટ હોય તો ત્યાં ખોદકામ કરવા જેવું શું હતું? શું રોમમાં પેંથિયનનું ખોદકામ કરવામાં આવ્યું હતું? ના, પેંથિયન આજુબાજુની સમકાલીન ઇમારતોની જેમજ જમીની સ્તર પર છે. અને એવું કેમ છે? કારણ કે પેંથિયન સંભવત: રોમન યુગ દરમિયાન બનાવવામાં આવ્યું હતું. તે લગભગ કાર્ડિનલી ઓરિએન્ટેડ પણ છે, જે દર્શાવે છે કે એ ખૂબ પ્રાચીન નહીં હોય.","कोसा, इटलीमध्ये तुमचे स्वागत आहे. कोसा ही एक पुरातन रोमन वसाहत असल्याचे मानले जाते. या जागेवर मागील शतकामध्ये कमीत कमी चार वेळा उत्खनन करण्यात आले होते. कोसा जर मुळात एक रोमन वसाहत आहे, तर मग इथे उत्खनन करण्यासारखे काय आहे? रोममधील पँथिऑनमध्ये उत्खनन करण्यात आले का? नाही, पँथिऑन तर आसपासच्या समकालीन इमारतींच्या इतक्याच उंच जमिनीवर आहे. आणि असे का? कारण पँथिऑन बहुतेक रोमन काळात बांधले गेले. तसेच ते जवळजवळ ’कार्डिनली ओरिएंटेड’ आहे, याचा अर्थ ते इतके पुरातन असू शकणार नाही."
"વેનિસ, એટલે પાણી પર વસેલું શહેર. સુંદરતા અને રોમાંસથી ભરપુર આ જગ્યા દર વર્ષે લાખો મુલાકાતીઓને આકર્ષિત કરે છે. જાણીતા પર્યટક માર્ગોથી થોડાં જ પગલા દૂર, એક ખૂબ જ અલગ વેનિસ છે, જે આકર્ષક જીવોથી સમૃદ્ધ છે. આ ફિલ્મ તે વેનિસની શોધખોળ કરે છે જેને ખૂબ ઓછા લોકો સ્વનજરે જુએ છે, એક એવું શહેર જેનું જીવન આશ્ચર્યજનક રીતે બમણું છે.","व्हेनिस, पाण्यावर तरंगते शहर. प्रत्येक वर्षी लाखो लोक जिथे भेट देतात असे सौंदर्य आणि प्रेमाचे प्रतीक असलेले ठिकाण. पर्यटकांच्या नकाशापासून थोडेसेच दूर असे एक वेगळे व्हेनिस शहरदेखील आहे, जिथे अनोखे सजीव राहतात. या फिल्ममध्ये आपण फार कमी जणांनी पाहिलेले व्हेनिस अनुभवणार आहोत. हे शहर जणू काही दुहेरी जीवन जगत आहे."
"અમે તૈયાર નથી. અને તમે ગ્રેગને કાઢી નાખ્યો છે તે તો હજી વધુ ખતરનાક થવાનું છે. કારણ કે અમારી પાસે તેને આપવા માટે પૈસા નથી, બર્ટ. આ તમે કરી રહ્યાં છો, હું નહીં. મારું નસીબ જ છે. શું તમે સમજતા નથી કે આ બાળકોને અહીં લાવવા માટે મારે શું કરવું પડ્યું? વીમા કંપની માટે મારે જે પૈસા આપવા પડ્યા, તમે આ બધું ગુમાવવા માંગો છો? બાળકો પૈકી કોઈ એકને ઇજાના જોખમમાં મૂકવાને બદલે? હા. કેમ? પહેલાં ક્યારેય તમને હેરાન નથી કર્યાં.","आपण तयार नाही. आणि तू ग्रेगला नोकरीवरून काढून टाकल्यामुळे हे अजून जास्त धोकादायक बनले आहे. कारण आपल्याकडे त्याला द्यायला पैसे नव्हते, बर्ट. हे तू करत आहेस, मी नाही. होय, मीच. या मुलांना इथून बाहेर काढण्यासाठी मला काय करावे लागत आहे हे तुला समजत नाही का? विमा कंपनीसोबत मी केलेला करार, हे सर्व तुला गमवायचे आहे का? त्यापेक्षा मुलांना इजा होण्याचा धोका पत्करायचा? होय. का? यापूर्वी तू कधी पर्वा केली नाहीस."
