Gujrati,marathi
"જો કે ઉપલબ્ધ ડેટાના આધારે તમે વિમાનના મૉડલોની કેટલીક સરખામણી કરી શકો છો પરંતુ FAA સલાહ આપે છે કે દુર્ઘટના રેકોર્ડના આધારે એરલાઇનની સરખામણી કરવાના પ્રયત્નથી બચવું જોઈએ. ઍડમિનિસ્ટ્રેશન દ્વારા આપવામાં આવેલા એક રિપોર્ટ અનુસાર, ""વર્તમાન દુર્ઘટના ડેટામાં એવો કોઈ પુરાવો નથી કે જ તેમના સુરક્ષા રેકોર્ડના આધારે વ્યક્તિગત એરલાઇનની રેંકિંગનું સમર્થન કરશે.""","उपलब्ध डेटानुसार तुम्ही एअरक्राफ्ट मॉडेल्सच्या काही तुलना करू शकत असलात, तरी एअरलाईन्सचे किती अपघात झाले या नोंदींवर आधारीत त्यांची तुलना करू नये असा FAA सल्ला देते. प्रशासनाद्वारे उद्धृत एका अहवालानुसार, ""अपघात डेटामध्ये सध्या असा कोणताही पुरावा नाही जो एअरलाईन्सच्या सुरक्षितता नोंदींवर आधारीत त्यांना वैयक्तिक रँकिंग देण्याचे समर्थन करेल."""
"જો કે FAA અનુસાર કોઈપણ સમયે એરલાઇનના સુરક્ષા રેકોર્ડ વચ્ચે ઘણીવાર નોંધપાત્ર અંતર હોય છે, તે મુખ્ય રૂપે ""હવાઈ દુર્ઘટનાની દુર્લભ પરંતુ વિનાશકારી પ્રકૃતિ""ને લીધે હોય છે અને સમય જતા વિવધ એરલાઇનની વચ્ચે આ સ્પષ્ટ અંતર પણ દૂર થઈ જાય છે. FAA એ કૉમેન્ટની વિનંતીને નકારી દીધી છે.","कोणत्याही ठराविक बिंदूला एअरलाईन्सच्या सुरक्षितता नोंदींमध्ये अनेकदा ठळक फरक असतात, तरी FAA अनुसार हे प्रामुख्याने ""हवाई अपघाताच्या वरचेवर नसलेल्या, परंतु आपत्तीजनक स्वरूपामुळे,"" घडते आणि एअरलाईन्समध्ये दिसून येणारे हे फरक कालांतराने एकसमान होतात. FAA ने टिप्पणी करण्यास नकार दिला."
કેવી રીતે બૅટ્ટા એડુ એક નિષ્ક્રિય રાજનીતિક સિસ્ટમ માટે બલિના બકરા બની ગયા,बेटा एडू अकार्यक्षम राजकीय प्रणालीमध्ये बळीचा बकरा कशा बनल्या
"રાષ્ટ્રપતિ બોલા અહમદ ટીનુબૂના શાસનમાં માનવીય બાબતો અને ગરીબી ઉન્મૂલન મંત્રી બેટ્ટા એડૂ સાથે જોડાયેલી એક હાલની ઘટનામાં, N585 10 લાખ પેલિએટિવ ફંડના દુરુપયોગના આરોપોની વચ્ચે તેમને પદ પરથી કાઢી નાખવાની માગ કરવામાં આવી છે. મંત્રીને એક લીક મેમોના જાહેર થયા પછી મહત્ત્વપૂર્ણ સાર્વજનિક પ્રતિક્રિયાનો સામનો કરવો પડ્યો, જ્યાં તેમણે કથિત રીતે મહાસંઘના એકાઉન્ટન્ટ-જનરલ (AG) ઓલુવાટોયિન મેડેનને N585 10 લાખને એક ખાનગી એકાઉન્ટમાં ટ્રાન્સફર કરવાની સૂચના આપી હતી.","बोला अहमद तिनुबू यांच्या प्रशासनातील मानवतावादी व्यवहार आणि दारिद्र्य निर्मूलन मंत्री बेटा एडू यांचा समावेश असलेल्या अलीकडील एका घटनेमध्ये, N585 दशलक्षच्या उपशामक निधीबाबत गैरव्यवहाराच्या आरोपांवरून त्यांना पदच्युत करण्याबाबत गदारोळ उडाला. फेडरेशनचे अकाउंट-जनरल (AG) ओल्युवॅटोईन मादेन यांना मंत्र्यांनी कथित N585 दशलक्ष एका खाजगी खात्यामध्ये हस्तांतरीत करण्याबाबत सूचना दिल्याचा एक मेमो उघड झाल्यामुळे त्यांना मोठ्या प्रमाणावर जनतेच्या रोषाला सामोरे जावे लागले."
"20 ડિસેમ્બર 2023ના રોજ લીક થયેલા મેમો અનુસાર, એડુએ એકાઉન્ટન્ટ-જનરલને રાષ્ટ્રીય સામાજિક રોકાણ ઑફિસના એકાઉન્ટમાંથી બ્રિજેટ ઓનિયેલુ, જે શ્રીમતી એડુના મંત્રાલય હેઠળના ""ગ્રાન્ટ ફૉર વલ્નરેબલ ગ્રૂપ"" નામના સંઘ સરકારના 'ગરીબી હટાવો' પ્રોજેક્ટના એકાઉન્ટન્ટ છે તેમના ખાનગી એકાઉન્ટમાં ફંડ ટ્રાન્સફર કરવાનો નિર્દેશ આપ્યો.","उघड झालेल्या 20 डिसेंबर 2023 च्या मेमोनुसार, एडू यांनी अकाउंटंट-जनरल यांना राष्ट्रीय सामाजिक गुंतवणूक कार्यालयाच्या खात्यातून ब्रिजेट ओनियेलू यांच्या खात्यामध्ये निधी हस्तांतरीत करण्याबाबत निर्देश दिले. ब्रिजेट हे श्रीमती एडू यांच्या मंत्रालयातील फेडरल प्रशासनाच्या ""असुरक्षित समूहांसाठी निधी"" या दारिद्र्य हस्तक्षेप प्रकल्पाचे अकाउंटंट आहेत."
"એડુ વતી વાત કરતા તેમના મીડિયા સહયોગી રશીદ ઝુબેરે દાવો કર્યો કે આ અધિનિયમ નાઇજીરિયન સિવિલ સેવાના માળખામાં કાયદેસર છે. જો કે, એ ધ્યાનમાં રાખવું મહત્ત્વપૂર્ણ છે કે આ વિનંતી નાઇજીરિયાના નાણાકીય અધિનિયમ 2009ની વિવિધ કલમોનું ઉલ્લંઘન કરે છે, જે સ્પષ્ટ રૂપથી સરકારી વ્યવસાયમાં દગો અને ભ્રષ્ટાચારના અન્ય પ્રકારોને પ્રતિબંધિત કરે છે. આ ઉપરાંત, નાઇજીરિયાના નાણાકીય અધિનિયમ 2009ના અધ્યાય સાતની કલમ 713માં સ્પષ્ટ રીતે જણાવવામાં આવ્યું છે, ""વ્યક્તિગત પૈસાની ચુકવણી કોઈપણ પરિસ્થિતિમાં સરકારી બેંક એકાઉન્ટમાં કરવામાં આવશે નહીં, ન તો કોઈ સાર્વજનિક પૈસાની ચુકવણી કોઈ ખાનગી એકાઉન્ટમાં કરાશે."" આમાં આગળ કહેવામાં આવ્યું છે કે ""કોઈપણ અધિકારી જે સાર્વજનિક પૈસાની ખાનગી એકાઉન્ટમાં ચુકવણી કરે છે, તેને કપટપૂર્ણ ઇરાદાથી આવું કરાયું એમ માનવામાં આવશે.""","एडू यांच्या वतीने बोलताना, त्यांचे माध्यम सहाय्यक रशीद झुबेर ठामपणे म्हणाले की नायजेरियन नागरी सेवेच्या चौकटीत ही कृती कायदेशीर आहे. तथापि, याची नोंद घेणे महत्त्वाचे आहे की सरकारी व्यवसायातील फसवणूक आणि अन्य प्रकारच्या भ्रष्टाचाराला प्रतिबंध करणाऱ्या नायजेरियाच्या वित्तीय नियमने २००९ च्या विविध कलमांचे ही विनंती उल्लंघन करते. तसेच, नायजेरियाच्या वित्तीय नियमने 2009 च्या कलम 713, प्रकरण सात मध्ये स्पष्ट नमूद केलेले आहे की, ""कोणत्याही परिस्थितींमध्ये वैयक्तिक पैसा सरकारी बँक खात्यामध्ये भरला जाऊ नये, तसेच कोणताही सार्वजनिक पैसा खाजगी खात्यामध्ये भरला जाऊ नये."" त्यामध्ये पुढे नमूद केले आहे की, ""जो कोणी अधिकारी सार्वजनिक पैसा खाजगी खात्यामध्ये भरेल त्याने ते फसवणुकीच्या हेतूने केले आहे असे मानले जाईल."""
"વેંચર્સ આફ્રિકા સાથેના એક ઇન્ટરવ્યૂમાં, એક મોખરાની કોમર્શિયલ બેંકના અનામ વરિષ્ઠ કાનૂની અધિકારીએ ટિપ્પણી કરી, ""આ મુદ્દાને લગતી ઘણી બધી સમસ્યાઓ છે. પ્રથમ, તેણીનું મંત્રાલય તુલનાત્મક રીતે નવું છે અને તેના પૂર્વવર્તી અને અગ્રણી મંત્રી સાદિયા ઉમર-ફારુક, એવી ઍક્ટિવિટીમાં સંડોવાયેલા છે જે ગેરકાનૂની લાગે છે. આ તે વાતનું પ્રતિબિંબ હોઈ શકે છે કે તેઓ મંત્રાલયમાં કેવી રીતે કામ કરે છે, છતાં, ખાનગી એકાઉન્ટમાં સાર્વજનિક પૈસાની ચુકવણી કરવી સાર્વજનિક ખરીદીના નિયમોની વિરુદ્ધ છે."" તેમણે કહ્યું કે જ્યાં સુધી તેણી આ પ્રકારની મંજૂરી માટે કોઈ વૈધ કારણ બતાવી શકતી નથી, ત્યાં સુધી જરૂરી નથી કે આમાં કપટપૂર્ણ ઇરાદો શામેલ હોય, પરંતુ તેમ છતાં આ ખોટું છે અને નિશ્ચિતતાનો અભાવ છે.","व्हेंच्युरा आफ्रिकाला दिलेल्या एका मुलाखतीत, एका प्रमुख व्यावसायिक बँकेच्या अनामिक वरिष्ठ कायदा अधिकाऱ्याने टिप्पणी केली की ""या विषयाबाबत अनेक समस्या आहेत. सर्वप्रथम, त्यांचे मंत्रालय तुलनेने नवीन आहे आणि त्यांच्या पूर्ववर्ती आणि अग्रणी मंत्री, सादिया उमर-फारूक यांचा बेकायदेशीर दिसणाऱ्या उपक्रमांमध्ये सहभाग आहे. ते मंत्रालयाचा कारभार कसा चालवतात याचे हे प्रतिबिंब असू शकते. काहीही असले, तरी सार्वजनिक पैसा खाजगी खात्यांमध्ये वळवणे हे सार्वजनिक खरेदी नियमांच्या विरुद्ध आहे."" ते पुढे म्हणाले की अशा मंजुरीसाठी जोपर्यंत त्या वैध कारण प्रदान करू शकतात, तोपर्यंत त्यामध्ये फसवणुकीचा हेतू असेलच असे नाही, परंतु काहीही झालं तरी ते चुकीचेच आहे आणि त्यामध्ये नक्कीच त्रुटी आहे."
"એક ટ્વીટર પોસ્ટમાં, રાજકીય અને ડિજિટલ સંચારના નિષ્ણાત અકિન અકિનવાલે એવો અભિપ્રાય વ્યક્ત કર્યો છે કે કદાચ મંત્રાલય દ્વારા વ્યક્તિગત એકાઉન્ટનો ઉપયોગ કરવો એમાં કદાચ કંઈપણ ખોટું નથી.","एका ट्विटर पोस्टमध्ये, राजकीय आणि डिजिटल संवाद तज्ज्ञ अकिन अकिनवाले यांनी असे मत व्यक्त केले की वैयक्तिक खाते वापरण्याबाबत कदाचित मंत्रालयाची चूक नसेल."
"પોતાના ટ્વિટર એકાઉન્ટ પર આ જ પ્રકારની ભાવના વ્યક્ત કરતા, રાજનીતિક વિશ્લેષક અને વિકાસ અને સંચાલન સલાહકાર, બેરિસ્ટર લિયાબો અવોકોયાએ નિલંબિત મંત્રી પ્રત્યે સહાનુભૂતિ વ્યક્ત કરી. તેમનું માનવું હતું કે મંત્રીએ પોતાનું કામ પૂરું કરવાના ઉત્સાહી દૃઢ સંકલ્પથી પ્રેરિત થઈને એક નિર્દોષ ભૂલ કરી હશે.","आपल्या ट्विटर खात्यावर तुलनात्मक भावना व्यक्त करताना, राजकीय विश्लेषक आणि विकास व व्यवस्थापन सल्लागार, बॅरिस्टर आयाबो एवोकोया यांनी निलंबित मंत्र्यांबाबत सहानुभूती व्यक्त केली. त्यांना वाटते की आपले काम पूर्ण करण्याच्या आवेशात मंत्र्यांकडून निष्पाप भावनेने ही चूक झालेली असू शकते."
"આ અનુભવોના આધારે, દલીલોથી, એ અનુમાન લગાડી શકાય છે કે સંઘીય સરકાર અને અન્ય સરકારી પૅરાસ્ટેટલની વચ્ચે નાણાંકીય કાયદાઓમાં મતભેદ હાજર છે. સ્થિતિ હવે વધી ગઈ જ્યારે લીક થયેલો દસ્તાવેજ સાર્વજનિક થઈ ગયો, બૅટ્ટા એડુ એક નિષ્ક્રિય રાજનીતિક વ્યવસ્થા માટે એક બલિના બકરા તરીકે ઉભરીને સામે આવ્યા.","या तज्ज्ञ युक्तीवादावर आधारीत, फेडरल प्रशासन आणि इतर प्रशासन पॅरास्टॅटल्स यांच्यात वित्तीय कायद्यांवर मतभेद आहेत असे अनुमान काढले जाऊ शकते. उघड झालेला दस्तऐवज सार्वजनिक झाला तेव्हा परिस्थिती आणखी चिघळली, ज्यातून अकार्यक्षम राजकीय प्रणालीच्या बेटा एडू बळीचा बकरा ठरल्या."
"સેલેસ્ટે મારી મનપસંદ છે ""નાની સારી ફ્રીવેયર ગેમથી લઈને મોટી બ્લોટેડ વાણિજ્યિક ગેમ છે, જે મૂર્ખતાપૂર્ણ વિસ્તૃત કલાની સાથે આવે છે"" કરપ્શન આર્ક છે કારણ કે મૂળમાં ડબલ ડૅશ મેળવવું એ એક ટ્રેઝર ચેસ્ટમાં સંદર્ભહીન પાવરઅપ છે અને કોમર્શિયલ ગેમમાં આ મારી મનપસંદ છે",वेड्यासारख्या तपशीलवार कलेसह मोठ्या फुगलेल्या व्यावसायिक खेळातील पिटुकला छान फ्रीवेअर खेळ' असे असणारा सेलेस्टमध्ये एक मेख आहे कारण मूळ खेळात डबल डॅश मिळवणे हे खजिन्याच्या पेटीतील कोणत्याही संदर्भाशिवाय मिळणाऱ्या शक्तीसारखे आहे आणि व्यावसायिक खेळामध्ये मला त्यामुळे रडू येते.
"સામાન્ય રીતે મને બે ગેમની વચ્ચે ઇન્ટરપ્લે ખરેખર પસંદ છે. નાની સ્ટોરીનો લાભ એ છે કે તમે ""સારા ભાગ પર સ્કિપ કરી શકો છો"", તે વધુ તાત્કાલિક રીતે વધુ મનોરંજક અને સંતોષજનક હોઈ શકે છે. લાંબી સ્ટોરીનો લાભ એ છે કે તમે જે કંઈ પણ થાય છે તેને વધુ ભાવનાત્મક ભાર સાથે આત્મસાત કરી શકો છો, તમે મજબૂત પેઑફના બદલામાં તાત્કાલિકતાને ગુમાવો છો.","सर्वसाधारणपणे, मला या दोन खेळांतील परस्परक्रिया खरोखरच आवडतात. लघुरूपातील कथांचा फायदा म्हणजे तुम्ही ""वगळून चांगल्या भागाकडे जाऊ शकता"", त्या जास्त पटकन गुंतवणाऱ्या आणि समाधानकारक असू शकतात. दीर्घरूपातील कथांचा फायदा म्हणजे जे काही घडले ते अधिक भावनिक पद्धतीने तुम्ही बिंबवू शकता, अधिक भक्कम फायद्यांसाठी तुम्ही तात्काळता गमावता."
"કોમર્શિયલ ગેમ સેલેસ્ટેનો ક્લાઇમેક્સ ખરેખર ફક્ત પાઇકો-8 ગેમ છે, જેણે અમને અચંભિત કર્યા છે, કેટલીય કલાકોના યાંત્રિક અને કથાત્મક નિર્માણે આને હજી વધુ મુશ્કેલ બનાવી દીધી છે. સેલેસ્ટેને તેની નાની મૂળ ગેમ પર એટલો ગર્વ છે કે તે આમાં સ્મારક, ""2000 એમ... 2500 એમ..."" પ્રગતિ, પાવર-અપ, ટોચ પર ધ્વજ જેવા સંદર્ભ સામેલ કરે છે. આ તમને શીર્ષક સ્ક્રીનથી જ મૂળ ગેમ રમવાની સુવિધા આપે છે!","सेलेस्ट या व्यावसायिक खेळाचा परमोच्च बिंदू हा अक्षरशः पिको-8 खेळ आहे, उडवलेला, ज्यामध्ये अनेक तास यांत्रिक आणि वर्णनात्मक वर्णन वाढवलेले असून तो पॉप ऑफ करणे खूप म्हणजे खूपच अवघड होऊ दिले आहे. सेलेस्टला आपल्या पिटुकल्या पेरेंट गेमचा इतका अभिमान आहे की तो अगदी मुखोद्गत असल्यासारखे संदर्भ फेकत असतो, ""2000 M... 2500 M..."" प्रगती, शक्तीवाढ, ध्वज शिखरावर. अगदी शीर्षक स्क्रीनपासून तो तुम्हाला मूळ खेळ खेळू देतो!"
"સેલેસ્ટે એ પાઇકો-8 ગેમનું ""સારું વર્ઝન"" અથવા ""મઠારેલું વર્ઝન"" નથી, તે સમાન મુખ્ય વાર્તાનો બસ એક અલગ અભિગમ છે. કારણ કે કોઈ વ્યક્તિ જેને ટૂંકી અને લાંબી બંને સામગ્રી ગમે છે, કનેક્શનને આ રીતે ઉજાગર થતું જોવું ખરેખર રસપ્રદ અને આનંદદાયક છે.","सेलेस्ट ही पिको-8 खेळाची ""चांगली आवृत्ती"" किंवा ""पूर्ण झालेली आवृत्ती"" नाही, तो फक्त त्याच मूळ कथेबाबत भिन्न दृष्टिकोन आहे. ज्याला लघुरूप आणि दीर्घरूप असे दोन्हीही प्रकार आवडतात, त्यांना अशाप्रकारे कनेक्शन जोडलेले पाहणे खरोखरच रंजक आणि आनंददायक आहे."
