Gujrati,marathi
"હું કેલિફોર્નિયા જઈ રહ્યો છું. તમે કેલિફોર્નિયા જઈ રહ્યા છો. પણ તમારે કેલિફોર્નિયા શા માટે જવું જોઈએ? અમેરિકા તમારા માટે પૂરતું નથી? આહ! તમે એક સારા નાગરિક છો. ખરેખર? તમને એ પણ ખબર નથી કે કેલિફોર્નિયા અમેરિકામાં આવેલું છે! અને તમને હસવું શેનું આવે છે? હસવું તો મારે જોઈએ, કારણ કે તમે બહુ ભોળા છો, તમને ખબર પણ ન પડી કે હું તમારી સાથે મજાક કરી રહ્યો છું.","मी कॅलिफोर्नियाला जात आहे. तू कॅलिफोर्नियाला जात आहेस आणि कॅलिफोर्नियाला का जात आहेस? यूनायटेड स्‍टेट्स तुला फारसे आवडले नाही का? अरे! तू चांगला नागरिक आहेस, हो ना? तुला कॅलिफोर्निया युनायटेड स्‍टेट्समध्‍ये आहे हेदेखील माहीत नाही! पण, तुला कशावर हसू येत आहे? मला हसू येत आहे, कारण तू खूपच मूर्ख आहेस, मी तुझ्यावर विनोद करत आहे हेदेखील तुला कळत नाहीये."
"હેલો, એક નવી સીરિઝના પાયલટ એપિસોડમાં આપનું સ્વાગત છે. આપણે વિશ્વના કેટલાક સૌથી ખરાબ કૌંભાંડોના ઇતિહાસમાં ઝંપલાવશું-- અમુકની તમને ખબર હોઈ શકે અને અમુક વિશેની ખબર ન પણ હોય. તે અમુક અંશે સ્કેનલ નામના RTE પ્રોગ્રામ દ્વારા પ્રેરિત છે. જો કે, આયર્લૅન્ડ સાથે જોડાયેલી ઘટનાઓ પર ફોકસ કરવાને બદલે, હું જે વિષયો આવરીશ તેને સંબંધિત જ્ઞાન વધારવાનું વિચારી રહ્યો છું. તો ચાલો, વધુ વિલંબ કર્યા વિના, શરૂ કરીએ.","हॅलो आणि नवीन सीरीजच्‍या प्रकारातील पायलटमध्‍ये स्‍वागत आहे. जगभरातील सर्वात वाइट घोटाळ्यांपैकी काहींच्‍या इतिहासावर नजर टाकणार आहोत--तुम्‍हाला काही माहीत असतील आणि काही नसतील. हे स्‍कॅनल नावाच्या आरटीइ प्रोग्रामपासून काहीसे प्रेरित आहे. तरीही, आयर्लंडशी निगडीत इव्‍हेंट्सवर लक्ष्‍य केंद्रित करण्‍यापेक्षा, मी काय कव्‍हर करू शकेन यावर यावर अधिकाधिक लक्ष्‍य देण्‍याची माझी योजना आहे. असो, आणखी उशीर न करता, सुरुवात करूया."
"હા, મને અમુક રી--- ગમ્યા હતા. મેં આજની રાત માટે તૈયાર થવા માટે થોડુંક સંશોધન પણ કર્યું, કારણ કે મેં જેમ કહ્યું હતું તેમ, હું સાચેમાં મૂર્ખ છું--. સરકાર વિશે હું ફક્ત એટલું જ જાણું છું કે આપણે અહીં શા માટે છીએ, અને એ છે કે તે આપણા માટે કામ નથી કરતી. ખરેખર, મને ફક્ત એટલું જ ખબર છે. તો આ જાણવાનું સારું લાગ્યું. પરંતુ મેં બિલ કેવી રીતે કાયદો બને છે તેના પર થોડું સંશોધન કર્યું. તો મેં Schoolhouse Rockનો વીડિયો જોયો. હા, અમને બધાને તે ગમ્યો.","होय, मला काही आवडले--. मी आज रात्रीसाठी तयारी करण्‍याकरिता काही संशोधन केले आहे, कारण मी सांगितल्‍याप्रमाणे, मी खरोखर मूर्ख आहे--. शासनाबद्दल मला एकच गोष्‍ट माहीत असल्‍याने आपण येथे आहोत, जी आपल्‍यासाठी काम करत नाही. तसेच, आपल्‍याला हे सर्व काही माहीत आहे. म्‍हणून अशा प्रकारचे काम करणे चांगले असेल. परंतु विधेयक कायदा कसा बनला अशासारखे काही संशोधन मी केले. म्हणून मी स्कूलहाऊस रॉक व्हिडिओ पाहिला. होय, आपल्या सर्वांना ते आवडते."
"ઓહ દુનિયા! તું કેટલા સરપ્રાઇઝથી ભરાયેલી છે, નહીં? મને યાદ છે કે થોડા વર્ષો પહેલા, મિલા જોવોવિચ વાળી રેસિડન્ટ ઇવિલ ફિલ્મો જોઈને મેં વિચાર્યું હતું કે, ""આનાથી વધુ ખરાબ કઇંક ન બની શકે!"" હા, તે સમય સરળ લાગતો હતો. પરંતુ 2021ના અંતિમ હાંફતા શ્વાસ સાથે, તેઓ રેસિડન્ટ ઇવિલ:વેલકમ ટુ રેકૂન સિટી લાવ્યા. વેલકમ ટુ રેકૂન એટલે કે નરકમાં આપનું સ્વાગત છે.","तू, तूच जग आहेस! तू म्हणजे आश्‍चर्यांचा खजिना आहेस, आहेस ना? मला काही वर्षांपूर्वींचे काही आठवते, मिला जोवोविचसोबतच्‍या त्‍या रेसिडेंट एव्हिल चित्रपटांपैकी काही पाहत आहे आणि विचार करत आहे, ""यापेक्षा वाइट काहीही होऊ शकत नाही!"" होय, ती एक सर्वसाधारण वेळ वाटतेय. परंतु 2021 मध्‍ये शेवटी सखोल श्‍वास घेऊन, रेसिडेंट एव्हिलच्‍या रुपात बाहेर आला: रकून शहरात स्‍वागत आहे. उर्फ, नरकात आपले स्वागत आहे."
"બધાને નમસ્કાર,  Its Dwight રસોઈ શોમાં આપનું સ્વાગત છે. આજે હું તમને ટુના મેક્રોની સલાડની રૅસિપિ આપીશ. સરસ અને સરળ. એકદમ સરળ રૅસિપિ. અહીં મારી સામગ્રીનું લિસ્ટ તમે જોઈ શકો છો: મારું કૅપ્સિકમ, મારી લીલી ડુંગળી, મારી સફેદ ડુંગળી, સ્વાદ માટે અડધી ચમચી મીઠું, કાળા મરી, અથવા જો તમારી પાસે પીસેલા મરી હોય, તો તમે તેનો ઉપયોગ કરી શકો છો, મારી મેક્રોની, ત્રણ ઈંડા જેને ઉકાળવામાં આવશે, અને મારી ટુના.","सर्वांना नमस्कार, इट्स ड्वाइट कुकिंग शोमध्ये आपले पुन्हा स्वागत आहे. आज मी तुम्हाला टूना मॅकरोनी सॅलड पाककृतीबद्दल सांगणार ​​आहे. छान आणि सोपी. अगदी सोपी पाककृती आहे. येथे तुम्‍ही माझे साहित्‍य पाहू शकाल: माझ्याकडील भोपळी मिरची, कांद्याची पात, पांढरे कांदे, चवीनुसार साधारण अर्धा चमचा मीठ, मिरी किंवा तुमच्‍याजवळ मिरपूड असेल तर तुम्‍ही ती वापरू शकता, मॅकरोनी, तीन अंडी जी उकडावी लागतील आणि माझे ट्युना."
"આજે અમે ટોકેહ બીચ પર છીએ. ટોકેહ બીચ અહીં સિએરા લિયોનમાં સ્થિત એક રિઝૉર્ટ છે. હું અહીં મારા ભાઈ-બહેનો સાથે છું. એક સુંદર દિવસ હોવો જોઈએ. બીચ પર એકદમ આરામદાયક સમય. કંઈ વધારે થઈ રહ્યું નથી કે કંઈ વિચાર્યું પણ નથી, પણ... ઓહ, એવું લાગે છે કે અહીં કોઈના લગ્નનું રિસેપ્શન છે. બધા લગ્ન કરી રહ્યાં છે. ઓહ, એવું લાગે છે કે અહીં લગ્ન કે કોઈ પ્રકારની સગાઈ છે. કેટલું સુંદર લાગે છે, નહીં?","आज आम्ही टोके बीच रिसॉर्टमध्ये आहोत. टोके बीच हे सिएरा लिओनमधील एक रिसॉर्ट आहे. मी इथे माझ्या चुलत भावंडांसोबत आहे. आजचा सुंदर दिवस असावा. समुद्रकिनारी खरोखर खूपच छान वेळ घालवला. काहीही विशेष घडले नाही किंवा काहीच योजना नव्‍हती, परंतु... ओह, कदाचित लग्‍नाचा स्‍वागत समारंभ असल्‍यासारखे दिसत आहे. प्रत्‍येकजण लग्‍न करत आहे. वाह, लग्‍न असल्‍यासारखे वाटत आहे किंवा साखरपुडा असाावा. खूपच सुंदर दिसत आहे. हो ना?"
"શિકારી પક્ષીના નિષ્ણાંત બોબ એન્ડરસનને પાયોનિયરનું વલણ ફકત ઘમંડી અને અજ્ઞાની લાગતું હતું. તમામ શિકારી પક્ષીઓને નીચ કક્ષાની પ્રજાતિઓ માનવામાં આવતી. એટલે, તેઓ બધા બાજ હતા. તે બધા ખરાબ પક્ષીઓ હતા, પછી તે બાલ્ડ ગરુડ હોય, સોનેરી ગરુડ હોય, રેડ-ટેઈલ્ડ બાજ હોય. તે બધાને ગોળીએ ઠાર મારવામાં આવ્યા હતા.","रॅप्टर तज्‍ज्ञ बॉब अँडरसन, प्रवर्तकाची वृत्‍ती अगदी उद्धट आणि दुर्लक्षित होती. बळी देण्‍यासाठी आणलेल्‍या पक्षांना किड्यांप्रमाणे समजले जात होते. मला असे म्‍हणायचे आहे की ते सर्व चिकनहॉक होते. ते सर्व वाइट पक्षी होते, बाल्‍ड इगल, गोल्‍डन इगल, लाल-शेपटीचे हॉक होते. सर्वांचा बळी घेतला."
"અને હું Infosysના CEO, ડૉ.વિશાલ સિક્કાથી શરૂઆત કરવા માગુ છું. વિશાલ, તમે રેલવે એન્જિનિયરના પુત્ર છો. તમે તે સમયની ટેક્નોલોજી જોઈ છે અને તમે સર્ફર પણ છો, તેથી લહેરોથી કેવી રીતે બચવું તે વિશે બધુ જ જાણો છો. નવી ટેક્નોલોજીમાંથી અમારે કયા વિક્ષેપ પર સૌથી વધુ ધ્યાન આપવાની જરૂર છે, અને શા માટે? વિક્ષેપ પર અમારે શા માટે આટલું ધ્યાન આપવું જોઈએ?","आणि मी आता डॉ.विशाल सिक्‍का, इन्‍फोसिसच्या सीइओंशी चर्चा करण्‍यास सुरुवात करणार आहे. विशाल, तू रेल्वे इंजिनिअरचा मुलगा आहेस. तू त्‍या टप्‍प्‍यात तंत्रज्ञान पाहिले आहेस आणि तू सर्फरदेखील आहेस, म्‍हणून तुला समस्‍यांवर मात कशी करायची हे माहीत आहे. नवीन तंत्रज्ञानांमध्‍ये आपण सर्वाधिक कोणत्‍या व्‍यत्‍ययावर लक्ष कशावर द्यायला हवे आणि का? आपण व्यत्ययावर जास्‍त लक्ष का द्यायला हवे?"
"પ્રાચીન પિત્તળના આભૂષણ બનાવવા માટે, મેં સૌથી પહેલાં આખા આભૂષણ પર રબ અને બફનો કોટ લગાવ્યો. પછી, પ્રાચીન દેખાવ માટે, મેં આલ્કોહોલની શાહીનો ઉપયોગ કર્યો. મેં પહેલાં આદુ પસંદ કર્યું. મેં આપણાં આભૂષણ પર એક ટીપું લગાવીને તેને આ રીતે મિશ્રિત કર્યું. મેં આ પ્રક્રિયાને ચાલુ રાખી જ્યાં સુધી મેં મારી મરજી મુજબના સ્તર બનાવી લીધા, અને તે ખરેખર સાચી ધાતુના પ્રાચીન આભૂષણ જેવું લાગતું હતું. તે પછી, મેં બળી ગયેલા એમ્બર સ્પ્રે પેઇન્ટનો પણ થોડો વધારે ઉપયોગ કર્યો અને તેને સપાટી પર લગાવ્યું, જેથી તેને ઓક્સિડાઇઝ દેખાવ મળે, એ જ રીતે જે આપણે ઘંટડીના ઘરેણાં માટે કર્યું હતું. આ રીતે મેં આ પ્રાચીન પિત્તળના બોબલ પૂરા કર્યા. ખરેખર સરસ અને સરળ, પરંતુ સાચું કહું તો, આ બધા સાચી ધાતુ જેવા દેખાય છે અને તેઓ સુંદર છે.","पुरातन पितळेचे दागिने तयार करण्‍यासाठी, मी फक्त घासून आणि पॉलिश करून संपूर्ण दागिन्याला एक कोट लावला आणि मग अर्थातच, आपल्याला अल्कोहोलच्या शाइने ते मूळ स्वरूप प्राप्त करावे लागले. म्‍हणून मी अगोदर जिंजर वापरुन पाहिले. मी काही थेंब दागिन्‍यावर लावले व फक्‍त पसरवून पाहिले आणि मला आवडेपर्यंत अधिकाधिक स्‍तर येइपर्यंत करत राहिलो/राहिले आणि ते वास्‍तविक धातुचा दागिना दिसू लागला. त्‍यानंतर, त्‍यानंतर, मी काहीसे बर्मिश अँबर स्‍प्रे पेंट देखील पाहिले आणि ते पृष्‍ठभागावर लावले, जसे आपण बेल दागिन्‍यांवर लावतो त्‍याप्रमाणे ऑक्सिडाइझ लूक देत होते आणि अशा प्रकारे मी पुरातन पितळेचे बॉबल्‍स पूर्ण केले. खरोखर साधे आणि सोपे, परंतु खरं सांगायचं तर ते खरे धातुसारखे दिसत होते आणि ते सुंदर होते."
"હાશ, છૂટ્યા",गुड रिडन्‍स
"માનવજાતિનો વિકાસ ક્યારેય અટકતો નથી, એક ક્ષણ માટે પણ નહીં- મુશ્કેલ સમયમાં આપણે ફરી એકવાર અનુકૂલિત થઈને વિકાસ કરીએ છીએ, શહેરો હંમેશાની જેમ સમૃદ્ધ છે, અને આપણી તકનીકી પ્રગતિ વધી રહી છે. ઈગ્નિયાટની અમારી તાજેતરની શોધ સાથે, માનવજાતિ એકાએક ઉચ્ચતમ સ્તરે પહોંચીને નવું ગગનચુંબી શિખર સર કરી રહી છે. સર્વશ્રેષ્ઠ બનવામાં હજી થોડું કામ બાકી છે. આ નવા જ્ઞાનની કૃપાને દૈવી હસ્તક્ષેપ જ કહી શકાય - આપણે માનવજાતિ હવે દેવોની ભૂમિ એટલે કે વાદળોમાં જઈને દેવતાઓ ઉપર કૃપા કરી શકીશું. કરાસીનની કંપનીમાં દરેક વ્યક્તિએ ઈગ્નિયાટનું મૂલ્યાંકન કર્યું છે અને અમને લાગે છે કે આ ખનિજની ક્ષમતા અભૂતપૂર્વ છે - ચિંતા ન કરો, ઈગ્નિયાટના ખનનની કોઈ નકારાત્મક અસર કે અનિચ્છનીય પરિણામો દેખાયા નથી, વધારે સંભાવના એવી છે કે -","मानवतेची प्रगती कधीही क्षणभरासाठी देखील थांबत नाही–कठीण प्रसंगी आपण प्रगती करत असतो आणि पुन्‍हा एकदा अनुकूल परिस्थिती निर्माण करतो. शहरे नेहमीप्रमाणे समृद्ध आहेत आणि आपली तांत्रिक प्रगती वाढत आहे. इग्निटच्या आमच्या अलीकडील शोधामुळे, मानवतेने एकदा शिखर गाठले आहे; महानता अजून मिळवायची आहे. नवीन सापडलेल्या ज्ञानाच्या या कृपेचे वर्णन केवळ दैवी हस्तक्षेप म्हणून केले जाऊ शकते - आम्ही मानवतेच्या देवांना त्यांच्या पृथ्वीवर त्यांच्या उपस्थितीसह ढगांमध्ये पाहू शकतो. कारासीनच्‍या कंपनीतील प्रत्‍येकाने इग्निअ‍ॅटचे मूल्‍यांकन केले आहे आणि या मिनरलमध्‍ये आम्‍हाला खूप संभाव्‍यता जाणवत आहेत – काळजी करू नका, इग्निअ‍ॅटचे उत्‍खनन करताना अनेक दुष्परिणाम किंवा नकारात्‍मक बाजू पाहण्‍यासाठी मूल्‍यांकन केलेले नाही, तसे होण्‍याची शक्‍यता टाळता येणार नाही–"
"14મી જાન્યુઆરી, 10:26 PM, 2543.","14 जानेवारी, 10:26 PM, 2543."
